commit,test_mean_macro_f1,test_st1_macro_f1,test_st2_macro_f1,test_st3_macro_f1,test_st3_family_macro_f1,dev_mean_macro_f1,dev_st1_macro_f1,dev_st2_macro_f1,dev_st3_macro_f1,dev_st3_family_macro_f1,model,status,description
b6ec7b4,n/a,n/a,n/a,n/a,n/a,n/a,n/a,n/a,n/a,n/a,Qwen/Qwen3-4B,discard,"qwen3-4b-2epoch (KILLED, no results): first real full-scale Qwen3-4B run (train=1853/dev=504/test-holdout=500, standing st12-only recipe: --context full, --pos-weight, epochs=2, --eval-every 2, lora_r=8/alpha=16, q_proj/v_proj, bf16 no quantization), launched after a successful smoke test (3 epochs on --sample-size 30, confirmed no-OOM end to end including test-holdout eval, which required a real bugfix -- see project-disk-and-4b-model-loading memory: the training model wasn't freed before reloading a second model for test-holdout, harmless at 0.6B scale but a genuine OOM at 4B; fixed with del model + empty_cache before the reload). Trained both epochs cleanly and fast enough to be practical (~60min/epoch, loss 0.715->0.078, a healthy trajectory comparable to the 0.6B track) but was killed by user request right as the epoch-2 dev eval was starting -- before any checkpoint or metric was produced. Zero usable data, though the infrastructure (model-path pointed at the HF cache snapshot, bf16 fits comfortably at full context, the test-holdout memory fix) is now proven and ready to reuse if the Qwen3-4B track is picked back up. User pivoted back to continuing the Qwen3-0.6B autoresearch loop instead."
b6ec7b4,n/a,n/a,n/a,n/a,n/a,n/a,n/a,n/a,n/a,n/a,Qwen/Qwen3-0.6B,discard,"st12-12epoch (CRASHED, no results, 2nd attempt): retry of the epochs=12 sweep after the first attempt was killed by user request before completion. This attempt crashed with a genuine torch.OutOfMemoryError ~18 steps into epoch 1, launched simultaneously with a fresh lr=4e-4 retry (row above did not exist yet at crash time; both jobs launched back-to-back within seconds). Error message shows the OTHER process (lr4e4) already at 14.89GB while this one had only 6.24GB -- i.e. the crash happened during the joint WARMUP RAMP of two freshly-launched jobs, not during steady-state training or a scheduled eval (unlike every prior incident in this file, which involved eval-phase or later-epoch memory growth). New lesson for project-two-parallel-gpu-jobs memory: launching 2 fresh jobs at the exact same moment is itself risky, independent of their later eval schedules -- both models' initial VRAM ramp-up (weight loading, optimizer state init, first few forward/backward passes before the allocator settles) can spike unpredictably and overlap. lr4e4 (launched microseconds earlier) survived; this one didn't. No checkpoint or data produced. Needs a re-run, ideally staggered by a few minutes from any concurrent launch rather than started in the same breath."
b6ec7b4,n/a,n/a,n/a,n/a,n/a,n/a,n/a,n/a,n/a,n/a,Qwen/Qwen3-0.6B,discard,"st12-12epoch (CRASHED, no results, 3rd attempt): retry #2, launched staggered ~1min after lr4e4 had already cleared its own warmup and reached steady state (85 steps in, ~2it/s) -- the staggering fix from the previous crash (row 35) did NOT prevent this one. Crashed with torch.OutOfMemoryError at step ~13 of its own epoch 1, while lr4e4 (already steady) was using 14.89GB alone -- notably higher than the ~9.8-10GB 'standard r=8' baseline established earlier in this file from different runs. This is the 3rd consecutive failure to get this specific epochs=12 config running paired with anything (1 user-requested kill, 2 real OOM crashes). Revises the project-two-parallel-gpu-jobs memory's core premise: standard r=8 configs do NOT reliably use a fixed ~10GB -- observed range this session is roughly 10-15GB depending on run, not a stable number safe to budget against for pairing. Giving up on pairing epochs=12 for now; queued to run solo once lr4e4 finishes."
b6ec7b4,0.721,0.706,0.736,n/a,n/a,0.647,0.703,0.592,n/a,n/a,Qwen/Qwen3-0.6B,keep,"st12-5epoch-lr4e4: lr sweep at the epochs=5 standing recipe -- lr 2e-4->4e-4, otherwise identical (--context full, --st12-only, --pos-weight, --eval-every 5, dev=504/test-holdout=500). Run solo after 3 consecutive crashes trying to pair it with an epochs=12 job (see project-two-parallel-gpu-jobs memory) -- this is the successful completion of the run first launched pre-Qwen3-4B-detour and killed by user request, then relaunched twice more. Result: test mean(st1,st2)=0.721 (st1=0.706/st2=0.736), dev mean=0.647 (st1=0.703/st2=0.592) -- mixed vs the lr=2e-4 baseline (row 26: test mean=0.702/dev mean=0.690): test slightly UP (+0.019, st1 +0.083/st2 -0.045), dev DOWN (-0.043, st1 -0.059/st2 -0.025). Same dev/test-disagreement pattern as the alpha32 ablation (row 30) -- read as noise floor, not a real lr effect either way. Keeping lr=2e-4 as the standing default (no clear case for changing it); this data point doesn't move the needle enough to justify the extra tuning surface."
b6ec7b4,n/a,n/a,n/a,n/a,n/a,n/a,n/a,n/a,n/a,n/a,Qwen/Qwen3-0.6B,discard,"st12-12epoch (STOPPED by strategic redirect, no results, 4th attempt): running solo, healthy (10:47 elapsed, no OOM this time) when the user redirected: stop epoch-sweeping entirely -- the eventual final production run will use 200 epochs, which subsumes whatever the 'best' epoch count within a small sweep would have found, making further epochs=N sweep experiments (5 vs 8 vs 12 vs ...) moot. Killed intentionally, not a crash. Epoch-count question closed for this autoresearch track; epochs=8 (row 31, test mean=0.793) remains the best CONFIRMED result on record, but it's no longer being treated as a recipe decision -- future experiments should focus on levers that matter independent of final epoch count: accuracy/performance (context, capacity, data-weighting, prompt design) and training/inference speed (throughput, batch size, attention implementation, etc.), per explicit user redirect."
b6ec7b4,n/a,n/a,n/a,n/a,n/a,n/a,n/a,n/a,n/a,n/a,Qwen/Qwen3-0.6B,discard,"st12-5epoch-batch2 (KILLED early, speed experiment): first attempt at a speed lever per user redirect away from epoch-sweeping toward performance/speed boosts. --batch-size 1->2, --grad-accum-steps 4->2 (same effective batch=4), otherwise the standing recipe (--context full, --st12-only, --pos-weight, epochs=5). Hypothesis was fewer/larger matmuls would speed up training; result is the opposite. Observed ~2.4-3.3s/it at batch=2 (927 steps/epoch) vs ~1.2-1.5s/it at batch=1 (1853 steps/epoch, see row 37's clean ~17min/epoch solo baseline) -- extrapolates to ~42-50min/epoch at batch=2, roughly 2.5-3x SLOWER than batch=1, not faster. Root cause: at batch=1 there is zero padding (each sequence processed alone); at batch=2, each pair pads to the longer sequence's length, and full-context lengths are highly variable (observed range ~1600-4036 tokens across runs) -- padding waste from mismatched pairs more than cancels any batching efficiency gain. Also used more memory (~17.8GB solo vs batch=1's ~10-15GB) with repeated OOM warnings. Killed after ~30s once the per-step slowdown was clear (no need to run all 5 epochs to confirm a negative result already this unambiguous). CONCLUSION: batch_size=1 remains correct for this pipeline given its highly variable full-context sequence lengths; naive batch-size increases are a net loss without length-bucketed sampling (not implemented) to group similar-length examples together first."
b6ec7b4,0.662,0.561,0.763,n/a,n/a,0.698,0.814,0.582,n/a,n/a,Qwen/Qwen3-0.6B,discard,"st12-5epoch-maxlen3072: speed lever per user redirect toward performance/speed boosts -- --max-length 4096->3072, batch=1 unchanged, otherwise standing recipe (--context full, --st12-only, --pos-weight, epochs=5, dev=504/test-holdout=500). CONFOUNDED result, flagging clearly: this run's fresh random split (test-holdout not seed-pinned, per the rotating-holdout rule) happened to have a max train sequence length of exactly 3012 tokens in ALL 5 epochs -- i.e. --max-length 3072 never actually truncated anything this run, unlike the max-length=4096 baseline runs which saw sequences up to ~4036 tokens. This is NOT a valid test of the speed-vs-accuracy truncation tradeoff -- it's just another single-run noise sample on a shorter-tailed split. Timing: ~15.6min/epoch vs row 37's clean solo ~17min/epoch baseline (~8% faster), but since no truncation occurred, this speed difference may itself be partly attributable to the shorter-tailed split rather than the max-length setting mechanically -- can't cleanly attribute. Accuracy: test mean=0.662 (st1=0.561/st2=0.763) vs row 26's baseline test mean=0.702 (st1=0.623/st2=0.781) -- below baseline; dev mean=0.698 (st1=0.814/st2=0.582) vs row 26's dev=0.690 -- roughly flat/slightly above. Same dev/test-disagreement noise pattern as rows 30/37. INCONCLUSIVE on whether --max-length 3072 helps or hurts -- would need a split where truncation actually triggers (e.g. pin --split-seed to one of the earlier runs' seeds that had long-tail examples) for a real test. Discarding as non-diagnostic, not as a negative result."
b6ec7b4,0.6605,0.622,0.699,n/a,n/a,0.6615,0.682,0.641,n/a,n/a,Qwen/Qwen3-0.6B,keep,"st12-5epoch-nogradckpt: speed lever per user redirect -- added --no-gradient-checkpointing flag (new, to build_peft_model_causal via lora_model.py) and tested it against the standing recipe (--context full, --st12-only, --pos-weight, epochs=5, lora_r=8/alpha=16, dev=504/test-holdout=500). CLEAN, CONFIRMED speed win: ~12min48s/epoch vs the checkpointing-enabled clean solo baseline's ~17min/epoch (row 37) -- a consistent ~25% speedup across all 5 epochs (12:50, 12:48, 12:48, 12:48, unknown-but-similar for ep5), no warmup-only fluke. Cost: solo VRAM ~17.3GB during training (vs checkpointing's ~10-15GB range) -- fits fine solo but makes this unsuitable for 2-parallel-job pairing (17.3*2 > 23GB), see project-two-parallel-gpu-jobs memory. Accuracy: test mean=0.6605 (st1=0.622/st2=0.699) vs row 26's baseline test mean=0.702 -- st1 nearly IDENTICAL (0.622 vs 0.623, essentially exact match), st2 down (0.699 vs 0.781). Dev mean=0.6615 (st1=0.682/st2=0.641) vs row 26's dev=0.690 -- also within noise range. Since gradient checkpointing is mathematically a no-op (recomputes the identical gradients via a different memory/compute tradeoff, doesn't change what's computed), any accuracy delta here is attributable to normal random-split noise, not the flag itself -- NOT a real accuracy cost. ADOPTING --no-gradient-checkpointing as the default for solo runs going forward (real ~25% time savings, no accuracy tradeoff); keep checkpointing ON when pairing 2 jobs (memory-constrained) or if a future config's VRAM footprint doesn't leave room for the higher usage."
be347f2,0.794,0.766,0.822,n/a,n/a,0.733,0.814,0.652,n/a,n/a,Qwen/Qwen3-0.6B,keep,"st12-100epoch-standing (KILLED at epoch 72 by user request, valid results): the long-run epoch-count question this whole queue was designed to answer -- standing recipe (r=8/alpha=16/lr=2e-4, --context full, --st12-only, --pos-weight, --no-gradient-checkpointing, --eval-every 10, split_seed=1556411495) run to epoch 100 instead of the old 5/8/12-epoch sweeps. Dev mean(st1,st2) trajectory: ep10=0.695, ep20=0.650, ep30=0.697, ep40=0.668, ep50=0.702, ep60=0.716, ep70=0.733 (best) -- NOT the overfit-after-peak pattern initially suspected from the ep10/ep20 dip; instead a noisy but sustained climb through 70% of the run, train loss pinned near 0 (fully memorized) since ~ep15 while dev kept improving regardless. Killed by explicit user request at epoch 72 (not a crash, not a detected decline) to free the GPU for the r16a32/alpha32/lr4e4 long-run queue. Test-holdout metrics were NOT produced automatically (kill skips the script's normal end-of-run reload+eval step), so they were reconstructed post-hoc: split_seed was logged at start (1556411495), used to regenerate the identical 500-instance holdout from train.jsonl, then ran a standalone generation+eval pass against the saved epoch-70 best/ adapter (script: reeval_killed_standing.py, not committed -- one-off, lives in scratchpad). Result: test mean(st1,st2)=0.794 (st1=0.766/st2=0.822), clearly above dev's 0.733 and the best test score in this file by a wide margin (previous best test_mean was 0.721, row 37's lr4e4 5-epoch run) -- strong generalization, no dev-overfitting red flag. Biggest confirmed result of the epoch-count question: more epochs helps well past 12, and the earlier 5/8/12-epoch sweep conclusions (epochs=8 test=0.793 mean_macro_f1, note different metric definition pre-st12-only) undersold the ceiling. Open question: whether epoch 72-100 would have kept climbing -- never observed, run killed before reaching it."
fbdbe82,0.643,0.594,0.692,n/a,n/a,0.665,0.726,0.604,n/a,n/a,Qwen/Qwen3-0.6B,keep,"st12-100epoch-r16a32 (KILLED at epoch 12 by user request -- 100-epoch queue cancelled entirely, autoresearch now capped at --epochs 10, see feedback_epoch_cap_10 memory): r=16/alpha=32 ablation of the standing recipe (r=8/alpha=16), checkpointing ON (not nogradckpt -- r=16 needs the VRAM headroom), otherwise identical (--context full, --st12-only, --pos-weight, --eval-every 10, split_seed=125361566). Killed before its epoch-20 eval; epoch-10 best/ checkpoint (dev mean(st1,st2)=0.665, st1=0.726/st2=0.604) already matched the new 10-epoch policy, so no rerun needed -- test-holdout metrics reconstructed post-hoc the same way as the standing-recipe row (reeval_killed_standing.py, split_seed edited to match this run, output pointed at runs/lora-qwen-st12-100epoch-r16a32/best). Result: test mean(st1,st2)=0.643 (st1=0.594/st2=0.692) vs dev's 0.665 -- roughly consistent, no dev-overfitting red flag. st1 test score is dragged down by an anomalous 'other' entry appearing in the st1 per-label breakdown (st1 taxonomy has only 4 labels: digital_content_or_services/none/physical_goods/physical_services -- 'other' is an st2 label, so this looks like a parse/eval artifact on this particular split rather than a real st1 confusion; not investigated further). Directly comparable to the standing recipe's own epoch-10 dev/test point (row above: dev=0.695, test reconstructed only at ep70 not ep10) -- r16a32's ep10 dev (0.665) is somewhat below standing's ep10 dev (0.695), a first (thin, single-run) signal that doubling LoRA capacity doesn't obviously help at this data scale, but one data point isn't enough to conclude anything -- would need the r8a32 alpha-only ablation (queued next) to separate the r vs alpha effect."
7fc12f7,0.651,0.651,n/a,n/a,n/a,0.692,0.692,n/a,n/a,n/a,Qwen/Qwen3-0.6B,keep,"st1-5epoch (baseline, no pos-weight/no oversample): first --st1-only autoresearch run (commit ce93e64), standing recipe otherwise (r=8/alpha=16/lr=2e-4, --context full, --no-gradient-checkpointing, --epochs 5 --eval-every 5 per feedback_epoch_cap_5, split_seed=1096163574). test st1_macro_f1=0.651 (per-label: digital_content_or_services=0.955, physical_goods=0.955, physical_services=0.746, none=0.600 [3 gold], other=0.000 [1 gold, essentially unlearnable at 2 train instances total]); dev st1_macro_f1=0.692 (per-label: digital=0.923, physical_goods=0.928, physical_services=0.744, none=0.174 [14 gold]). Train st1 distribution: physical_goods 47.8%/digital 45.4%/physical_services 5.2%/none 1.5%/other 0.1% -- heavy imbalance, 'none' and 'other' the clear weak points (F1 well below the two majority classes on both dev/test). log_prediction_diagnostics (commit 7fc12f7) confirmed working end-to-end: gold/pred count distribution + gold->pred cross-product both logged correctly, restricted to st1 only (no st2/st3 noise). This is the BASELINE for the upcoming pos-weight/oversample-rare-st1 comparison (new code just added, not yet run at scale) -- user asked to extend st3's imbalance-handling levers (pos-weight, oversample rare labels) to st1, motivated by exactly this none/other weakness."
da72b3e,0.563,0.563,n/a,n/a,n/a,0.715,0.715,n/a,n/a,n/a,Qwen/Qwen3-0.6B,keep,"st1-5epoch-poswt-oversample: adds --pos-weight (now covers st1 via new compute_class_weight categorical class-weighting, commit da72b3e) and --oversample-rare-st1 3 (oversampled 'none', the only st1 label under 5% train freq) to the st1-5epoch baseline (commit ed8af8e), otherwise identical recipe. DEV (fixed 504, apples-to-apples with baseline): st1_macro_f1 0.692->0.715 (+0.023). Per-label: none 0.174->0.353 (nearly DOUBLED, gold=14 both runs -- the lever's intended target), digital_content_or_services 0.923->0.917 (-0.006), physical_goods 0.928->0.907 (-0.021), physical_services 0.744->0.682 (-0.062) -- small majority-class cost, net positive. TEST (rotating holdout, fresh split every run per feedback_rotating_test_holdout): st1_macro_f1 0.651->0.563 (-0.088), reads as a regression but is confounded by test-split composition: baseline's test draw had only 3 gold 'none' instances (F1=0.600 on n=3, essentially noise), this run's draw had 14 gold 'none' (F1=0.222, recall 2/14) -- a much larger, more reliable sample showing the model still struggles with 'none' at test time despite the reweighting, OR simply a harder/differently-composed split (physical_goods/digital also dipped ~0.03-0.04 on test alongside none, consistent with a generally tougher draw). 'other' stayed at 0.000 F1 in both runs (2 total train instances, effectively unlearnable at this data scale). READ: dev (same fixed set, real apples-to-apples) shows a genuine, meaningful 'none' improvement with minor majority-class cost; test disagreement is most likely rotating-holdout noise given the none-count mismatch (n=3 vs n=14) rather than a clean contradiction, but not fully resolved -- a replicate (same lever, fresh split) would help confirm dev's signal generalizes before adopting pos-weight+oversample as the new st1 standing default."
da72b3e,0.781,0.781,n/a,n/a,n/a,0.791,0.791,n/a,n/a,n/a,Qwen/Qwen3-0.6B,keep,"st1-5epoch-poswt-oversample-rep2 (REPLICATE, fresh split_seed=1886484272): same code/recipe as the da72b3e/7479702 run (--pos-weight, --oversample-rare-st1 3, r=8/alpha=16/lr=2e-4, --context full, --no-gradient-checkpointing, --epochs 5 --eval-every 5), only the train/test-holdout split changed. Ran to test whether that run's dev-side none-label gain (0.174->0.353) reproduces on a fresh split, since the first run's test result disagreed (confounded by wildly different none gold counts: 3 vs 14). RESULT: dev st1_macro_f1=0.791 (vs baseline 0.692, first poswt+oversample run 0.715) -- clearly the best dev score in the st1-only track. Dev per-label: digital_content_or_services=0.929, physical_goods=0.930, physical_services=0.830, none=0.476 (gold=14, same count as the first run's dev draw -- directly comparable) -- none F1 nearly TRIPLED vs baseline (0.174) and clearly beats the first run's 0.353, confirming the dev-side signal reproduces and even strengthens on a fresh split. TEST also agrees this time: st1_macro_f1=0.781 (vs baseline 0.651, first run's noisy 0.563), per-label digital=0.934/physical_goods=0.947/physical_services=0.868/none=0.375 (gold=11) -- test and dev now move together in the same direction, resolving the previous run's dev/test disagreement. CONCLUSION: pos-weight + oversample-rare-st1 3x is a genuine, reproducible improvement for st1, not a fluke of the first split's none composition -- promoting this to the new st1-only standing recipe default going forward. Train loss fell to 0.0021 by epoch 5 (fully memorized, oversampled set n=1905), no sign of dev-overfitting given dev kept improving in step with test."
001a5d9,0.770,0.770,n/a,n/a,n/a,0.740,0.740,n/a,n/a,n/a,Qwen/Qwen3-0.6B,keep,"st1-5epoch-fewshot: --few-shot in ISOLATION (curated exemplars from lora_few_shot.py's build_st1_few_shot_section, commit 001a5d9) against the plain st1-only baseline (ed8af8e/7fc12f7, no pos-weight/oversample stacked) for clean attribution, otherwise identical recipe (r=8/alpha=16/lr=2e-4, --context full, --no-gradient-checkpointing, --epochs 5 --eval-every 5, split_seed fresh). RESULT: dev st1_macro_f1 0.692->0.740 (+0.048), test 0.651->0.770 (+0.119) -- dev and test agree directionally, a real gain from few-shot alone. Dev per-label vs baseline: none 0.174->0.320 (n=14 both, nearly DOUBLED but well short of the pos-weight+oversample lever's 0.476), physical_services 0.744->0.809 (+0.065), digital_content_or_services 0.923->0.915 (~flat), physical_goods 0.928->0.918 (~flat). Test per-label: none=0.500 (n=5, small sample), physical_services=0.700 (n=32, down slightly from baseline's 0.746 on a different split -- within split noise), digital=0.940, physical_goods=0.940 (both up slightly). CONCLUSION: few-shot alone is a genuine, smaller-than-pos-weight+oversample lever for the same weak labels (none, physical_services) -- helps but doesn't match the imbalance-handling levers' none gain. Worth testing STACKED with --pos-weight --oversample-rare-st1 3 next (the new standing default, see feedback_st1_focus memory) to see if the two levers compound or saturate on the same weak labels."
