commit,test_mean_macro_f1,test_st1_macro_f1,test_st2_macro_f1,test_st3_macro_f1,test_st3_family_macro_f1,dev_mean_macro_f1,dev_st1_macro_f1,dev_st2_macro_f1,dev_st3_macro_f1,dev_st3_family_macro_f1,model,status,description
001a5d9,0.726,0.726,n/a,n/a,n/a,0.728,0.728,n/a,n/a,n/a,Qwen/Qwen3-0.6B,keep,"st1-5epoch-fewshot-poswt-oversample (STACKED): combines --few-shot with --pos-weight --oversample-rare-st1 3 (the two levers independently confirmed above: rep2 poswt+oversample dev=0.791/test=0.781, fewshot-alone dev=0.740/test=0.770), otherwise identical recipe. RESULT: the levers do NOT compound -- dev st1_macro_f1=0.728, test=0.726, BOTH LOWER than either individual lever alone (dev/test agree closely, 0.728 vs 0.726, so this is a real effect not split noise). Per-label diagnosis: none improved over baseline (test 0.400 vs baseline 0.600@n=3-noisy, roughly matching few-shot-alone's ballpark) but physical_services COLLAPSED (test 0.625 vs poswt+oversample-alone's 0.868 and fewshot-alone's 0.700 -- clearly the worst of all three configs on this label), digital/physical_goods stayed flat/strong (0.934/0.945). Read: stacking oversampling (3x replication of already-few-shot-lengthened, token-budget-constrained prompts per [[project_few_shot_st1]]) onto physical_services -- which relies on the model correctly weighing a longer prompt against tighter segment-text truncation -- likely over-trains on the rarer oversampled classes (none/other) at physical_services' expense; the two interventions target overlapping-but-different failure modes and interfere rather than help. CONCLUSION: do NOT stack --few-shot with --pos-weight/--oversample-rare-st1 -- keep them as separate, mutually exclusive candidate configs. pos-weight+oversample-rare-st1 alone remains the best st1-only config found so far (test st1_macro_f1=0.781) and stays the standing default; few-shot alone is a secondary candidate worth keeping in the toolbox but not combining with the imbalance levers."
da72b3e,0.834,0.834,n/a,n/a,n/a,0.585,0.585,n/a,n/a,n/a,Qwen/Qwen3-0.6B,keep,"st1-5epoch-poswt-oversample-r16a32 (capacity ablation, split_seed=721952958): lora_r=16/alpha=32 (doubled from the r8/a16 standing recipe) on top of the confirmed pos-weight+oversample-rare-st1 default, otherwise identical recipe, no --few-shot. INCONCLUSIVE/NEEDS REPLICATE -- dev and test wildly disagree in OPPOSITE directions from usual: dev st1_macro_f1=0.585 (worst of any st1-only run this session) but test=0.834 (BEST of any st1-only run this session, beating r8/a16's 0.781). Two confounds explain the dev score, neither of which is a clean 'capacity is bad' signal: (1) METRIC ARTIFACT -- dev predictions included exactly 1 spurious 'other' label (gold=0, pred=1) out of 504 instances; since ST1_LABELS genuinely has 5 values (digital_content_or_services/none/physical_goods/physical_services/other) but 'other' has only ~2 train instances and essentially never appears in a 504-dev draw in any other run this session, its single appearance here introduced a forced-0.000 5th term into the macro average, which by itself explains most of the raw-score gap: EXCLUDING 'other', corrected dev st1_macro_f1 = mean(digital=0.927, none=0.250, physical_goods=0.940, physical_services=0.808) = 0.731, much closer to r8/a16's 0.791. (2) REAL BUT SMALLER regression -- even corrected, dev 'none' recall genuinely dropped (2/14 correct vs r8/a16's better recall, dev none F1 0.250 vs 0.476), consistent with train loss hitting 0.0003 (near-total memorization) suggesting the extra capacity overfits harder on the oversampled rare classes specifically. Test (clean 4-label breakdown, no 'other' artifact): none F1=0.714 (gold=8, recall 5/8) -- much better than dev's 14-gold draw, but n=8 is a small, noisy sample per [[feedback_rotating_test_holdout]], and digital/physical_goods both near-ceiling (0.949/0.950) while physical_services dipped to 0.723 (vs r8/a16's 0.868). Also observed 1 transient CUDACachingAllocator OOM warning early in epoch 1 (non-fatal, training continued normally, GPU settled at ~17.4GB/23GB) -- r16 costs meaningfully more VRAM than r8, worth watching if pairing 2 parallel jobs. CONCLUSION: cannot judge capacity's effect from this single run -- the dev/test disagreement is the same rotating-holdout-noise pattern that required a replicate for the pos-weight+oversample lever earlier in this session (see [[feedback_st1_focus]]); queue a fresh-split replicate before drawing any conclusion about lora_r=16/alpha=32."
da72b3e,0.804,0.804,n/a,n/a,n/a,0.775,0.775,n/a,n/a,n/a,Qwen/Qwen3-0.6B,keep,"st1-5epoch-poswt-oversample-r16a32-rep2 (REPLICATE, fresh split_seed): resolves the prior r16a32 run's dev/test disagreement. Clean run this time, no 'other'-label artifact in either eval. RESULT: dev st1_macro_f1=0.775, test=0.804 -- dev and test now AGREE (both high, close together), the good-generalization pattern per [[feedback_rotating_test_holdout]]'s updated framing, and this BEATS the r8/a16 standing recipe on both sides (dev 0.791->0.775 is a small dip but test 0.781->0.804 is a clear gain, net positive and much more stable-looking than r8/a16's own single-run numbers). Per-label test: digital=0.942, none=0.500 (up from r8/a16's 0.375), physical_goods=0.938, physical_services=0.837 (down slightly from r8/a16's 0.868) -- broadly comparable, none specifically improved. Per-label dev: digital=0.922, none=0.381, physical_goods=0.944, physical_services=0.852 -- also solid, no weak spots. CONCLUSION: with the replicate now showing clean dev/test agreement and a net edge over r8/a16, lora_r=16/alpha=32 looks like a genuine (if modest) improvement over the r8/a16 standing recipe when paired with pos-weight+oversample-rare-st1 -- the first run's apparent 'dev crashes to 0.585' result was a false alarm, fully explained by the rare 'other'-label metric artifact plus one unlucky none-recall draw, not a real capacity-hurts-generalization effect. Two data points now favor r16a32 (test 0.834, 0.804) vs r8a16's two (0.781, plus original 0.563/0.651 from earlier in the session pre-dating the pos-weight+oversample lever) -- promoting r16/a32 as the new candidate standing default alongside pos-weight+oversample-rare-st1, though a third replicate would further firm this up given the noise floor documented in feedback_rotating_test_holdout. Also note: this run again briefly hit a transient (non-fatal) CUDACachingAllocator OOM warning at the very start of epoch 1, same as the first r16a32 run -- a repeatable characteristic of r16's VRAM footprint under --no-gradient-checkpointing, not a fluke; watch free VRAM if pairing 2 parallel jobs with this config."
da72b3e,0.686,0.686,n/a,n/a,n/a,0.758,0.758,n/a,n/a,n/a,Qwen/Qwen3-0.6B,keep,"st1-5epoch-poswt-oversample-r32a64 (capacity ablation, extends the r8->r16 trend): doubles rank again (lora_r=32/alpha=64, same 2:1 ratio) on top of pos-weight+oversample-rare-st1, otherwise identical recipe. RESULT: dev st1_macro_f1=0.758, test=0.686 -- both clearly BELOW r16/a32's replicate (dev=0.775/test=0.804) and the r8/a16 standing recipe (dev=0.791/test=0.781), and this time dev > test (not a wild opposite-direction swing like the first r16a32 run -- gap of 0.072 is within the documented noise floor per [[feedback_rotating_test_holdout]], both numbers agree directionally that this config is weaker). Per-label test: none=0.154 (worst none score of any st1-only run this session, gold=11), physical_services=0.694 (down from r8a16's 0.868/r16a32's 0.837), digital/physical_goods still near-ceiling (0.946/0.951). Train loss hit 0.0006 by epoch 5 -- the LOWEST (most memorized/overfit) of all three ranks tested (r8=0.0021, r16=0.0025, r32=0.0006), consistent with a genuine overfitting story: more capacity keeps memorizing train faster without a corresponding generalization gain past r16, and starts actively hurting the already-fragile rare 'none'/physical_services labels. No 'other'-label artifact this run (clean 4-label breakdown both dev/test). CONCLUSION: the r8->r16->r32 capacity sweep looks like an inverted-U -- r16/a32 is at or near the sweet spot, r32/a64 is a clear regression not worth replicating (dev/test agree on the direction, no surprising disagreement to resolve). Do not pursue r64+ without a strong reason. NOTE on standing-default ranking (per updated [[feedback_rotating_test_holdout]] guidance to prefer dev>=test among agreeing runs): r8/a16 pos-weight+oversample (dev=0.791>=test=0.781) is actually the MORE trustworthy candidate under that stricter rule than r16/a32's replicate (dev=0.775<test=0.804, test beats the cleaner dev set) -- revising the earlier 'r16a32 is the new best' call; r8/a16+pos-weight+oversample remains the primary standing default, with r16/a32 as a close secondary candidate rather than a clear promotion."
da72b3e,0.573,0.573,n/a,n/a,n/a,0.574,0.574,n/a,n/a,n/a,Qwen/Qwen3-0.6B,discard,"st1-5epoch-poswt-oversample-transcript (context-rung ablation): --context transcript (cheapest rung, drops product-page/dialog-flow segment context) vs the standing 'full' context, on the r8/a16+pos-weight+oversample recipe, otherwise identical. RESULT: clean, confirmed regression -- dev=0.574, test=0.573 (agree closely, both clearly below full context's dev=0.791/test=0.781, large effect size, no replicate needed). Every st1 label dropped: dev none COLLAPSED to 0.000 (gold=14, recall 0/14) vs full's 0.476; test none=0.125 (recall low), digital dev 0.823 (vs 0.929)/test 0.835 (vs 0.934), physical_goods dev 0.804 (vs 0.930)/test 0.859 (vs 0.947), physical_services dev 0.667 (vs 0.830)/test 0.474 (vs 0.868, the biggest single-label drop). CONCLUSION: unlike the hope in [[feedback_st1_focus]]'s carried-over context that st1 alone might tolerate a cheaper context rung than st1+st2 combined needed, st1 clearly DOES need the full product-page/dialog-flow context -- the earlier full-context requirement documented for st1+st2 combined was NOT purely an st2-driven effect. Speed observation (real, worth keeping in mind for any future efficiency-motivated context reduction): transcript-only trains at ~3.5it/s vs full-context's ~1.5-2.3it/s, roughly 9min/epoch vs 14-17min/epoch -- meaningfully faster, but not worth the accuracy cost here. Keep --context full as the standing default; discarding this direction, no need to test the intermediate rungs (no_product_page/st2_page) given full's clear necessity."
e61b805,0.593,0.593,n/a,n/a,n/a,0.730,0.730,n/a,n/a,n/a,Qwen/Qwen3-0.6B,discard,"st1-5epoch-poswt-oversample-minority-select: first test of the new --minority-select flag (commits e61b805/c14b044) on the standing recipe, --eval-every 1 so every epoch gets its own checkpoint to choose among. RESULT: the default --majority-f1-tolerance 0.02 is TOO STRICT to be useful on this run's trajectory -- per-epoch minority_f1/majority_f1: ep1=(0.667,0.765), ep2=(0.444,0.836), ep3=(0.250,0.862), ep4=(0.273,0.875), ep5=(0.211,0.903). majority_f1 climbed MONOTONICALLY with steps of 0.028-0.071 per epoch, always bigger than the 0.02 tolerance window, so no epoch besides the single best-majority epoch (5) ever fell within tolerance of it -- 'eligible' collapsed to just [epoch 5], and the algorithm degenerated to picking the single best-majority-F1 epoch, the OPPOSITE of its intended minority-favoring behavior. Worse: epoch 5's minority_f1 (0.211) is the WORST of all 5 epochs, while epoch 1 (minority_f1=0.667, by far the best minority epoch) has majority_f1=0.765, 0.138 below the ceiling -- nowhere close to eligible. Net effect: minority-select's pick (dev st1_macro_f1=0.730) actually did WORSE than what the plain default selection_metric would have picked in this same run (epoch 1, dev st1_macro_f1=0.741, the single best raw macro epoch, which happens to coincide with peak minority performance here since epoch 1 hadn't yet started overfitting toward majority classes). Test (best_dir=epoch5 checkpoint): raw st1_macro_f1=0.593, but this again includes one stray 'other'-label prediction (same rare-5th-taxonomy-value artifact documented in [[feedback_st1_focus]]) -- corrected excluding it: mean(digital=0.962, none=0.333, physical_goods=0.958, physical_services=0.711)=0.741, roughly matching dev. Both corrected numbers (0.730 dev / 0.741 test) land clearly below the plain r8/a16 standing recipe's dev=0.791/test=0.781. CONCLUSION: --minority-select's default --majority-f1-tolerance 0.02 needs to be widened substantially (the observed per-epoch majority_f1 deltas here were 0.03-0.07) before this flag can deliver its intended tradeoff on this dataset/config -- queueing a follow-up with a much wider tolerance (e.g. 0.10-0.15) to test whether the mechanism works when given room to actually consider epoch 1's strong minority performance."
