commit,test_mean_macro_f1,test_st1_macro_f1,test_st2_macro_f1,test_st3_macro_f1,test_st3_family_macro_f1,dev_mean_macro_f1,dev_st1_macro_f1,dev_st2_macro_f1,dev_st3_macro_f1,dev_st3_family_macro_f1,model,status,description
9e8946a,n/a,n/a,n/a,0.196,0.345,n/a,n/a,n/a,0.219,0.363,Qwen/Qwen3-0.6B,keep,"context-sweep 2/4: --context no_product_page --st3-only, matched epochs=2, --pos-weight, split_seed=207367891. dev st3=0.219 (epoch2)/test=0.196 -- essentially flat vs context-sweep 1/4's transcript-only result (dev=0.201/test=0.200), despite mean input length growing 1666->2157 tokens (+491, adding video title/description/official_disclosure). Adding video metadata doesn't clearly help or hurt st3 at this scale. Consistent so far with the separate data-analysis finding (see project-st3-context-rungs memory) that most st3 labels don't benefit from context beyond the transcript."
9e8946a,n/a,n/a,n/a,0.211,0.396,n/a,n/a,n/a,0.224,0.397,Qwen/Qwen3-0.6B,keep,"context-sweep 3/4: --context st2_page --st3-only, matched epochs=2, --pos-weight, split_seed=1809711824. dev st3=0.224 (epoch2, best of the sweep so far)/test=0.211 (also best test so far), mean input length ~2347 tokens (vs transcript's ~1666, no_product_page's ~2157) -- so filtering the product page down to just its ST2-bearing lines does slightly outperform both transcript-only and no_product_page, a small but consistent step up rather than flat. Still within the ~0.02-0.03 range of the other two sweep points, not a dramatic win, but the only context level so far to beat transcript-only on both dev and test simultaneously."
9e8946a,n/a,0.624,0.711,n/a,n/a,n/a,0.618,0.538,n/a,n/a,Qwen/Qwen3-0.6B,keep,"st1/st2-focused baseline (RE-PRIORITIZED 2026-08-14: user pivoted away from st3 entirely, see feedback-st12-focus memory): --st12-only (new flag, mirror of --st3-only -- completion drops st3 entirely, {""st1"":...,""st2"":[...]} only), --context full (standing default), matched epochs=2, --pos-weight, split_seed=1378751192. st3/mean_macro_f1 columns n/a (st3 is a fixed placeholder in this mode, not meaningful; best-checkpoint selection used mean(st1,st2)_macro_f1). Best dev at epoch 2: st1=0.618/st2=0.538 (mean=0.578, up from epoch1's 0.565). Test holdout: st1=0.624/st2=0.711 -- both at or above dev, no overfitting red flag, and st2 test notably higher than dev (0.711 vs 0.538) which is a good sign though single-run noise could be part of it. First trustworthy (leakage-fixed) full-context st1/st2 baseline -- next steps: try context ablation (transcript-only etc, mirroring the st3 sweep) and without --pos-weight to see if it's helping or neutral for st1/st2 specifically."
9e8946a,n/a,0.559,0.485,n/a,n/a,n/a,0.570,0.463,n/a,n/a,Qwen/Qwen3-0.6B,discard,"st12-only context ablation: --context transcript (vs full-context baseline above), matched epochs=2, --pos-weight, split_seed=230126473. dev st1=0.570/st2=0.463 (mean=0.517), test st1=0.559/st2=0.485 (mean=0.522) -- both clearly below the full-context baseline (dev mean=0.578, test mean=0.667), unlike the st3 sweep where dropping context barely moved st3_macro_f1. Makes sense: st2 (product category) plausibly depends heavily on the product page/video metadata that transcript-only discards, unlike st3's compliance flags which are mostly transcript-derived. Discarding transcript-only for st1/st2 -- keep full context as the standing recipe for this target; no further context-reduction ablation planned unless a cheaper rung (e.g. no_product_page) is worth checking for a smaller cost/accuracy tradeoff."
9e8946a,n/a,0.613,0.775,n/a,n/a,n/a,0.713,0.592,n/a,n/a,Qwen/Qwen3-0.6B,discard,"st12-only WITHOUT --pos-weight (isolating its effect vs the full-context baseline above, which had --pos-weight on), --context full, matched epochs=2, split_seed=166953285. Best dev at epoch 2: st1=0.713/st2=0.592 (mean=0.652) -- clearly above the pos-weight baseline's dev mean=0.578 (+0.074, epoch1 here already beat pos-weight's epoch2). Test: st1=0.613/st2=0.775 (mean=0.694), also above the pos-weight baseline's test mean=0.667. Initially read as a real pos-weight-hurts-st1/st2 signal and provisionally adopted as the standing recipe -- but see the replicate row directly below, which did NOT reproduce this. Downgrading to discard/inconclusive: this run's strength was likely a favorable split draw, not a real pos-weight effect. Kept in the file as the noise-floor illustration for st12-only, same lesson as the st3-only era's exp5 (see superseded feedback-st3-focus)."
9e8946a,n/a,0.517,0.671,n/a,n/a,n/a,0.605,0.572,n/a,n/a,Qwen/Qwen3-0.6B,discard,"st12-only WITHOUT --pos-weight, REPLICATE of the row above on a fresh split_seed=833084525 (same recipe: --context full, matched epochs=2, no --pos-weight) -- the critical reproducibility check for the ""pos-weight hurts st1/st2"" hypothesis. Does NOT reproduce: dev mean=0.588 (vs the first no-pos-weight run's 0.652, and close to the ORIGINAL pos-weight baseline's dev=0.578); test mean=0.594, actually BELOW the pos-weight baseline's test=0.667. Conclusion: --pos-weight's effect on st1/st2 (like its effect on st3 in the earlier era, see superseded feedback-st3-focus exp6/7/8) is NOT distinguishable from the rotating-holdout noise floor (~0.07-0.15 swings between identical-recipe runs, consistent with the ~0.09-0.22 range established for the full mean_macro_f1 metric). No confident recipe change here -- reverting the standing st12-only recipe to keep --pos-weight ON (matches the rest of the codebase's default, no clear harm or benefit either way). Two single-run pos-weight-off results (0.652, 0.588 dev; 0.694, 0.594 test) bracket the one pos-weight-on result (0.578 dev, 0.667 test) rather than clearly beating it."
3764dad,0.483,0.560,0.531,0.357,0.491,0.439,0.493,0.452,0.374,0.434,Qwen/Qwen3-0.6B,keep,"row16-5epoch: post-leakage-fix re-run of row 16's recipe (--context transcript, --pos-weight, full st1/st2/st3 completion, standing hyperparams) at epochs 2->5, using the new --final-eval-only flag (added this run, uncommitted at time of run) to skip per-epoch dev generate()/evaluate() on epochs 1-4 -- only epoch 5 is scored/checkpointed. Also switched dev/test-holdout to small 100-instance subsamples (dev: seeded random 100/504 of dev.jsonl; --test-holdout 100 instead of 500) to keep the now-single eval pass cheap. Total runtime ~63min for 5 epochs + final eval on 2253 train instances, vs row 16's ~28min for 2 epochs + per-epoch eval on 1853/500/504 -- per-epoch-eval removal roughly offsets the extra epochs' training cost. IMPORTANT CONTEXT: row 16 (commit 2595582) predates the eval-leakage fix (9e8946a, see feedback-eval-leakage-bug memory) -- its dev=0.605/test=0.586 mean_macro_f1 and st3=0.608/0.549 are inflated (dev/test prompts had the gold answer embedded, model just echoed it), NOT a valid target to compare against. This row is the trustworthy post-fix measurement of the same recipe, not a replication of row 16's number. Result: test mean_macro_f1=0.483 (st1=0.560/st2=0.531/st3=0.357/st3_family=0.491), dev mean_macro_f1=0.439 (st1=0.493/st2=0.452/st3=0.374/st3_family=0.434) -- test slightly above dev (+0.044), no overfitting flag, though n=100 is a small, high-variance sample (do not treat this as precise as the standard 500/504 runs). st3 (0.357-0.374) is well above the matched-context, matched-completion-mode post-fix reference at 2 epochs (row 17, --st3-only, dev=0.201/test=0.200) -- consistent with 5 epochs helping, though row 17 trained st3 alone (all completion tokens on st3) while this row splits capacity across all three tasks, so the two are not a clean ablation of epochs alone. insufficient_context hit dev F1=1.000 (only 1-2 positives in this n=100 subsample, not a meaningful score) and is absent entirely from test's per-label breakdown (zero support in this n=100 test draw) -- both expected artifacts of shrinking holdout to 100 for a label with ~15 total positives dataset-wide, not a real result for that label. Keeping as the first trustworthy, higher-epoch-budget full-completion result on this context level; the --final-eval-only + small-subsample pattern is a reusable way to afford more epochs cheaply for future sweeps."
3764dad,n/a,0.689,0.818,n/a,n/a,n/a,0.596,0.578,n/a,n/a,Qwen/Qwen3-0.6B,keep,"st12-5epoch: standing st1/st2 baseline recipe (row 20: --st12-only, --context full, --pos-weight) at epochs 2->5, using --final-eval-only + 100-instance dev/test subsamples (same pattern as row 24 -- see project-final-eval-only-flag memory). split fresh per rotating-holdout rule (seed not pinned). st3/mean_macro_f1 columns n/a (st3 is a fixed placeholder in --st12-only mode, not meaningful; best-checkpoint selection used mean(st1,st2)_macro_f1). Total runtime ~104min (2253 train instances, 5 epochs, full context) vs row 20's ~30-40min estimate for 2 epochs on the full 1853/504/500 split with per-epoch eval -- --final-eval-only doesn't make 5 epochs of full-context training cheap, only removes the repeated per-epoch generate() cost; full-context prompts are the dominant cost either way. Result: test mean(st1,st2)=0.754 (st1=0.689/st2=0.818), dev mean(st1,st2)=0.587 (st1=0.596/st2=0.578) -- test clearly above dev (+0.167 gap, one of the largest seen in this track), no overfitting red flag but a bigger dev/test spread than most rows, plausibly n=100's higher variance rather than a real generalization gap. Compare to row 20 (matched recipe, 2 epochs, full 504 dev/500 test): test mean 0.667 (st1=0.624/st2=0.711) -> this row's test mean 0.754 (st1=0.689/st2=0.818), st1 +0.065 and st2 +0.107, both up. Dev also up: row20 dev mean=0.578 -> this row's 0.587 (+0.009, much smaller move, consistent with dev's smaller n=100 sample here vs row20's n=504 diluting the signal, or with test happening to be a favorable n=100 draw). Directionally consistent with row 24's finding (more epochs helps when per-epoch eval isn't gating epoch count) but on n=100 samples this is not yet a confirmed win to the same standard as the matched-n rows earlier in this file -- a repeat at the standard 500/504 sizes (accepting the higher per-epoch-eval-removed cost) would be needed to trust the magnitude, though the direction (more epochs help st1/st2 here) matches every other higher-epoch data point gathered so far. Keeping as the best st1/st2 test result recorded to date on this pipeline."
d3dedec,0.702,0.623,0.781,n/a,n/a,0.690,0.762,0.617,n/a,n/a,Qwen/Qwen3-0.6B,keep,"st12-5epoch-fullsize: full-size (dev=504/test-holdout=500) confirmation of row 25's n=100 result -- same recipe (--st12-only, --context full, --pos-weight, epochs=5, --final-eval-only), run concurrently with a parallel r=16 capacity ablation (see next row) as the first 2-experiments-at-once run on this GPU. st3/mean_macro_f1 n/a (st12-only placeholder, as in rows 20-25). Result: test mean(st1,st2)=0.702 (st1=0.623/st2=0.781), dev mean=0.690 (st1=0.762/st2=0.617) -- clearly above the 2-epoch baseline (row 20: test mean=0.667 st1=0.624/st2=0.711, dev mean=0.578 st1=0.618/st2=0.538): dev +0.112, test +0.035. st1 is roughly flat test-side (0.623 vs 0.624, noise) but st2 is up meaningfully (0.781 vs 0.711, +0.070) and dev st1 jumped substantially (0.762 vs 0.618, +0.144). Confirms row 25's n=100 estimate was directionally right (more epochs helps st1/st2) but quantitatively noisy in BOTH directions: n=100 UNDERestimated dev (0.587 vs this row's 0.690) and OVERestimated test (0.754 vs this row's 0.702) -- illustrates exactly why n=100 shouldn't be treated as precise, per the project-final-eval-only-flag memory's caveat. Runtime ~110min wall-clock (04:20-06:10), but the last ~35min overlapped with the parallel r=16 run below sharing the GPU, so this isn't a clean solo-run timing comparison to row 20's ~30-40min estimate for 2 epochs. Adopting epochs=5 as the new standing st12-only recipe given this confirms at full eval size; next: consider whether epochs>5 keeps helping or plateaus/overfits."
d3dedec,0.529,0.463,0.595,n/a,n/a,0.576,0.621,0.531,n/a,n/a,Qwen/Qwen3-0.6B,discard,"st12-5epoch-noproductpage: context ablation at the new epochs=5 standing recipe (row 26) -- --context no_product_page (drops the linked product page, keeps video title/description/official_disclosure) instead of full, otherwise identical (--st12-only, --pos-weight, --eval-every 5, dev=504/test-holdout=500). Run concurrently with the r=16 capacity ablation (next row) as the second 2-parallel-jobs run -- see project-two-parallel-gpu-jobs memory for an important incident from this run: the r=16 job crashed with a genuine CUDA OOM when both jobs' epoch-5 final eval passes landed at the same wall-clock moment (both used epochs=5 + --eval-every 5, i.e. identical eval schedules) -- eval-phase VRAM peaks (~14-15GB solo, per generate() + a second reloaded test_model instance) are much higher than steady-state training (~10GB), so 2 jobs' EVAL peaks can exceed 23GB even though their TRAINING peaks fit comfortably. This job survived (checkpoints saved before the peer crashed); the other did not. Result: test mean(st1,st2)=0.529 (st1=0.463/st2=0.595), dev mean=0.576 (st1=0.621/st2=0.531) -- clearly worse than the matched full-context row (row 26: test mean=0.702, dev mean=0.690) on both dev and test, by a wide margin (test -0.173, dev -0.114). Extends the earlier transcript-only finding (also clearly worse, see feedback-st12-focus memory) to this middle context rung: st2 in particular still needs the actual product page, not just video metadata, even at 5 epochs. Discarding no_product_page for st1/st2; full context remains necessary."
d3dedec,n/a,n/a,n/a,n/a,n/a,n/a,n/a,n/a,n/a,n/a,Qwen/Qwen3-0.6B,discard,"st12-5epoch-r16 (CRASHED, no results): LoRA capacity ablation at the epochs=5 standing recipe (row 26) -- lora_r 8->16, lora_alpha 16->32 (same 2:1 ratio), otherwise identical (--context full, --st12-only, --pos-weight, --eval-every 5, dev=504/test-holdout=500). Trained all 5 epochs successfully (loss 0.655->0.020, looked healthy) but crashed with torch.OutOfMemoryError during the epoch-5 dev eval's generate() call, at the exact moment the concurrently-running no_product_page job (row above) also hit its own epoch-5 eval -- both jobs used epochs=5 + --eval-every 5, an identical eval schedule, so their eval-phase VRAM peaks (~14-15GB each, far above the ~10GB training-phase footprint) collided and exceeded the 23GB GPU. No checkpoint was ever saved (crash occurred inside the eval block, before the post-loop save/test-holdout code) -- all 5 epochs of training are unrecoverable, this row has zero usable data. See project-two-parallel-gpu-jobs memory for the incident writeup and revised parallel-run guidance (stagger eval schedules or reduce --eval-batch-size for concurrent jobs going forward). Needs a re-run, either solo or staggered against its partner, before the r=16 capacity question can be answered."
d3dedec,0.758,0.734,0.781,n/a,n/a,0.702,0.805,0.598,n/a,n/a,Qwen/Qwen3-0.6B,keep,"st12-5epoch-r16-retry: successful re-run of the crashed r=16 capacity ablation (row 28), this time solo (no concurrent partner) at --eval-batch-size 8 (down from 16) after the OOM incident -- see project-two-parallel-gpu-jobs memory. Confirmed via nvidia-smi that lora_r=16 stabilizes at ~16.5GB solo training VRAM (much higher than lora_r=8's ~10GB), so this was deliberately not paired with a second job this time. Same recipe as row 26 otherwise (--context full, --st12-only, --pos-weight, epochs=5, --eval-every 5, dev=504/test-holdout=500), only lora_r 8->16 / lora_alpha 16->32 changed. Result: test mean(st1,st2)=0.758 (st1=0.734/st2=0.781), dev mean=0.702 (st1=0.805/st2=0.598) -- clearly above row 26's r=8 result (test mean=0.702, dev mean=0.690): test +0.055, dev +0.012. Driven almost entirely by st1 (test 0.623->0.734, +0.111; dev 0.762->0.805, +0.043) -- st2 is flat test-side (0.781 vs 0.781 exactly) and down slightly on dev (0.617->0.598, -0.019). This is the best st1/st2 test result recorded to date. Single run, no replicate yet -- the st1 gain is large enough to look like a real capacity effect rather than noise (consistent direction and magnitude across both dev and test), but per this project's established noise floor (~0.07-0.15 single-run swings seen repeatedly in the st3-era and replicated in the st12-era pos-weight check), a confirmatory re-run on a fresh split would be needed before fully trusting the magnitude. Promising direction: consider lora_r=16 as the new candidate standing recipe pending replication, and/or explore whether the gain is really about r or about alpha (both changed together here, same 2:1 ratio as before)."
d3dedec,0.746,0.711,0.781,n/a,n/a,0.685,0.758,0.612,n/a,n/a,Qwen/Qwen3-0.6B,keep,"st12-5epoch-alpha32: isolates whether row 29's r=16 gain (lora_r 8->16, lora_alpha 16->32 together, same 2:1 ratio) was really about rank or about alpha -- this run changes ONLY lora_alpha (16->32), keeping lora_r=8 (so alpha/r ratio moves from 2:1 to 4:1, unlike row 29 which kept the ratio fixed). Same recipe otherwise (--context full, --st12-only, --pos-weight, epochs=5, --eval-every 5, dev=504/test-holdout=500), run paired with the epochs=8 sweep (both --eval-batch-size 8, different epoch counts so eval passes don't collide -- see project-two-parallel-gpu-jobs memory for why that matters after the row 28 OOM). Result is genuinely mixed, not a clean answer: dev mean(st1,st2)=0.685 (st1=0.758/st2=0.612) is essentially FLAT vs the r=8/alpha=16 baseline (row 26: dev=0.690, -0.005) -- no sign of r=16's dev gain (0.702, +0.012). But test mean=0.746 (st1=0.711/st2=0.781) is well ABOVE baseline (row 26: test=0.702, +0.044) and close to r=16's test result (row 29: 0.758, only -0.012 short) -- st2 identical to both other rows at 0.781 exactly (test-side). So dev says alpha-alone doesn't replicate r=16's gain, test says alpha-alone captures MOST of it. These two signals point opposite directions on whether alpha or rank is the active ingredient -- most likely explanation is the established ~0.07-0.15 single-run noise floor on this eval surface (see feedback-st12-focus memory's pos-weight replicate finding) rather than a real, resolvable r-vs-alpha effect from 3 single runs (baseline/r16/alpha32) each on a different random split. Does NOT cleanly resolve the r-vs-alpha question. A true isolation would need lora_r=16 with lora_alpha LEFT AT 16 (untested combination) plus replicates of all three cells before trusting any of this -- not done here given time cost. Directionally, alpha32 alone still beats baseline on test by a comparable margin to r16, so alpha may matter more than assumed; not confirmed."
a865b2b,0.793,0.773,0.813,n/a,n/a,0.707,0.787,0.626,n/a,n/a,Qwen/Qwen3-0.6B,keep,"st12-8epoch: extends the epochs sweep (row 26 was epochs=5) to epochs=8, at the standing recipe otherwise (--context full, --st12-only, --pos-weight, lora_r=8/alpha=16, --eval-every 8 so only the final epoch is scored, dev=504/test-holdout=500). Run paired with the alpha=32 ablation (row 30) then the lr=4e-4 ablation, both r=8-based so safe to pair per project-two-parallel-gpu-jobs memory (unlike lora_r=16, which needs to run solo). Result: test mean(st1,st2)=0.793 (st1=0.773/st2=0.813), dev mean=0.707 (st1=0.787/st2=0.626) -- BEST result recorded to date on this pipeline, beating even the r=16 capacity ablation (row 29: test mean=0.758). Both st1 and st2 up substantially vs the epochs=5 baseline (row 26): test st1 +0.150 (0.623->0.773), test st2 +0.032 (0.781->0.813); dev st1 +0.025, dev st2 +0.009. Unlike the r=16/alpha=32 results (large st1 gain, flat st2), epochs=8 improves BOTH subtasks, and by a larger margin on st1 than either capacity lever did. Strongly suggests more epochs is the single most effective lever explored so far for this target -- worth testing whether epochs>8 keeps helping or plateaus/overfits (train loss was already down to 0.008 by epoch 8, so overfitting risk on TRAIN is plausible even though test held up fine here -- watch for this at higher epoch counts). Also worth testing epochs=8 combined with lora_r=16, though that pairing would need to run solo given lora_r=16's ~16.5GB VRAM footprint."
a865b2b,n/a,n/a,n/a,n/a,n/a,n/a,n/a,n/a,n/a,n/a,Qwen/Qwen3-0.6B,discard,"st12-5epoch-lr4e4 (KILLED, no results): lr sweep at the epochs=5 standing recipe -- lr 2e-4->4e-4, otherwise identical (--context full, --st12-only, --pos-weight, --eval-every 5, dev=504/test-holdout=500). Trained cleanly through epoch 4 (loss 0.041, on track and healthy, comparable trajectory to the standard-lr epochs=5 run) but was killed by user request at epoch 5 (mid-training, before its scheduled final eval) to free the GPU for a Qwen3-4B smoke test. No checkpoint or eval was ever produced -- --eval-every 5 means eval only happens at epoch 5, so this run has zero usable data. Needs a re-run if the lr=4e-4 question is still open."
a865b2b,n/a,n/a,n/a,n/a,n/a,n/a,n/a,n/a,n/a,n/a,Qwen/Qwen3-0.6B,discard,"st12-12epoch (KILLED, no results): epochs sweep extending row 31's epochs=8 finding further -- epochs=12, otherwise identical (--context full, --st12-only, --pos-weight, --eval-every 12, dev=504/test-holdout=500, lr=2e-4/lora_r=8 standard). Trained cleanly through epoch 2 (loss 1.044 -> continuing normally) but was killed by user request partway through epoch 2 to free the GPU for a Qwen3-4B smoke test. --eval-every 12 means eval only happens at epoch 12, so this run has zero usable data -- purely abandoned compute (~1hr). The 'does epochs>8 keep helping or plateau/overfit' question (flagged as open in row 31 / feedback-st12-focus memory) remains unanswered; needs a re-run."
