commit,script,model,approach,dev_macro_f1,dev_none_f1,dev_none_precision,dev_none_recall,test_macro_f1,test_none_f1,test_none_precision,test_none_recall,status,description
new,lora_train_st1_classifier.py,FacebookAI/roberta-base,multiclass_st1_5way,0.622,0.500,n/a,n/a,0.546,0.316,n/a,n/a,keep,"NEW LEVER, discovered via investigation (not user-requested this round -- autonomous follow-up): roberta-base's 512-token position-embedding ceiling means --context full at --max-length 512 silently truncates away the product PAGE block for most instances under HF's default right-truncation (keep start/drop end), since render_context puts TRANSCRIPT first and PAGE last. Measured: PAGE block starts after token 512 (i.e. is ENTIRELY dropped) in 234/300 (78%) of a random train sample; median full_context length is 1268 tokens vs the 512 budget. This silently undermines the --context full flag's intent for the entire encoder+MLP track -- Track 1 (generative Qwen, max-length 4096) genuinely sees the full context and confirmed it matters (feedback_st1_focus.md), but Track 2 has been running something much closer to transcript-only for most instances without anyone noticing. Added --truncation-side {left,right} flag (sets tokenizer.truncation_side before building datasets); 'left' keeps the END of the rendered text instead, preserving PAGE content at the cost of the transcript's tail. RESULT (paired same-session comparison, fresh splits, standing r8/a16/class-weight/oversample=3 recipe otherwise identical): truncation-side=left dev macro_f1=0.622 (best@epoch5, none=0.500) vs right's dev=0.543 (none=0.276) -- +0.079 macro, +0.224 none. Test: left macro_f1=0.546/none_f1=0.316 vs right's macro_f1=0.491/none_f1=0.190 -- +0.055 macro, +0.126 none. Both dev>=test (trustworthy direction), left's dev=0.622 is the best dev score seen anywhere in this classifier's history (previous best 0.598). CONCLUSION: strong, mechanistically-explained lead -- preserving the product-page content that Track 1 already confirmed matters for st1, instead of silently dropping it to truncation, looks like a genuine architecture-level fix rather than a hyperparameter nudge. NOT yet replicated -- launching a fresh-split replicate before promoting to standing default, per standing practice (every surprising result this session needed replication)."
new,lora_train_st1_classifier.py,FacebookAI/roberta-base,multiclass_st1_5way,0.645,0.562,n/a,n/a,0.538,0.222,n/a,n/a,keep,"REPLICATE (fresh split) of --truncation-side left. Dev macro_f1=0.645 (best@epoch5, none=0.562) -- even higher than run 1's 0.622, confirming the effect is real and not a lucky draw; both runs' dev score (0.622, 0.645) clearly clear every other config tried in this classifier's entire history (previous best 0.598). Test macro_f1=0.538 (vs run1's 0.546, close), test none_f1=0.222 (vs run1's 0.316, some spread -- consistent with the known small-none-count test-holdout noise pattern, not a contradiction). Both replicates show strong dev>=test agreement (gaps 0.076 and 0.107). CONCLUSION: --truncation-side left REPLICATES CLEANLY and is PROMOTED to the new standing default for lora_train_st1_classifier.py, superseding the implicit right-truncation default used by every prior run this session. Mechanistic explanation (preserving the product-PAGE content that Track 1 independently confirmed is decisive for st1, instead of silently truncating it away) makes this a trustworthy, non-coincidental finding, not just a hyperparameter nudge. New standing config: --model FacebookAI/roberta-base --context full --max-length 512 --truncation-side left --lora-r 8 --lora-alpha 16 --target-modules query,value --class-weight --oversample-rare-st1 3."
new,lora_train_st1_classifier.py,FacebookAI/roberta-base,multiclass_st1_5way,0.630,0.516,n/a,n/a,0.516,0.000,n/a,n/a,discard,"Re-test of the previously-discarded capacity bump (--lora-r 16 --lora-alpha 32) under the NEW --truncation-side left baseline, to check whether the earlier regression was an artifact of the truncated (page-less) context rather than a real capacity effect. Best dev checkpoint epoch5 (macro_f1=0.630, none=0.516) -- within the new baseline's dev range (0.622-0.645) but at its low end. Test macro_f1=0.516 (below baseline's 0.538-0.546) and test none_f1=0.000 (a collapse, despite dev none=0.516 looking fine) -- a real generalization failure on the rare class. CONCLUSION: capacity bump STILL underperforms r8/a16 even with the truncation fix -- the inverted-U capacity finding is independent of the truncation issue, not an artifact of it. r8/a16 remains standing."
new,lora_train_st1_classifier.py,FacebookAI/roberta-base,multiclass_st1_5way,0.612,0.444,n/a,n/a,0.541,0.182,n/a,n/a,discard,"Re-test of --oversample-rare-st1 2 (previously inconclusive/didn't replicate) under the NEW --truncation-side left baseline. Best dev checkpoint epoch5 (macro_f1=0.612, none=0.444) -- below the new oversample=3 baseline's dev range (0.622-0.645). Test macro_f1=0.541 (right in the baseline's 0.538-0.546 band, essentially a match) but test none_f1=0.182 (below baseline's 0.222-0.316). CONCLUSION: oversample=2 is roughly on par with oversample=3 on test macro but not better, and worse on dev and none -- confirms oversample=3 remains the right choice, the earlier inconclusive read (before the truncation fix) wasn't hiding a real effect that only shows up with more context. Oversample factor is a fully closed question now."
new,lora_train_st1_classifier.py,FacebookAI/roberta-base,multiclass_st1_5way,0.578,0.341,n/a,n/a,0.560,0.300,n/a,n/a,discard,"Follow-up to the truncation-side fix: diagnostic showed even --truncation-side left still loses PAGE's own START (product title/category, plausibly the most informative part) for 42%% of instances when PAGE alone exceeds the remaining 510-token budget. Built --page-token-budget N (new flag + ST1Dataset._encode_budgeted): reserves N tokens for PAGE specifically (kept from PAGE's start, tokenized/sliced independently) and gives the rest of the 510-token budget to the transcript+metadata prefix (kept from the prefix's end, closest to PAGE) -- guarantees both segments always get a fixed slice regardless of instance length, unlike whole-string truncation which is all-or-nothing per instance. Verified correctness via a standalone decode check (confirmed PAGE-like content -- prices, product names, payment methods -- appears at the sequence tail as intended) before running. RESULT at budget=300: dev macro_f1=0.578 (best@epoch3, none=0.341), test macro_f1=0.560/none_f1=0.300. Below the plain truncation-side=left baseline's dev range (0.622-0.645) though slightly above its test range (0.538-0.546). CONCLUSION: the fixed budget split does NOT clearly beat plain left-truncation -- likely because it forces prefix truncation on every instance regardless of need, whereas whole-string left-truncation only truncates when the instance actually exceeds 512 tokens (many don't). Test edge is within this task's established noise band, dev (the cleaner signal) is worse. Discarding budget=300 relative to the simpler, already-confirmed truncation-side=left default."
new,lora_train_st1_classifier.py,FacebookAI/roberta-base,multiclass_st1_5way,0.616,0.444,n/a,n/a,0.558,0.364,n/a,n/a,discard,"Same --page-token-budget mechanism as above, budget=400 (more room for PAGE, less for prefix). Best dev epoch4 (macro_f1=0.616, none=0.444) -- closer to the plain truncation-side=left baseline's dev range (0.622-0.645) than budget=300 was, but still at/below its low end, with a notably noisier early-epoch convergence (epoch1 macro_f1=0.294, a big dip vs plain left-truncation's smoother epoch1=~0.45-0.50). Test macro_f1=0.558/none_f1=0.364 -- again slightly above the plain baseline's test range, same pattern as budget=300. CONCLUSION: increasing the page budget from 300->400 moves dev closer to (but not past) the plain-truncation baseline -- consistent with the hypothesis that the fixed-split mechanism is strictly worse than adaptive whole-string truncation for instances that don't need PAGE-specific budgeting, and the gain from including PAGE's very start (vs whatever partial PAGE tail plain left-truncation would keep) isn't enough to offset that cost. NOT pursuing further budget values -- the direction is clear enough (added complexity without a confirmed win). Standing default remains plain --truncation-side left (no --page-token-budget)."
new,lora_train_st1_classifier.py,FacebookAI/roberta-base,multiclass_st1_5way,0.616,0.541,n/a,n/a,0.577,0.519,n/a,n/a,keep,"Max-length sweep (user asked to characterize how much context window is worth, before swapping in a longer-context model): --max-length 128 with --truncation-side left, everything else standing (r8/a16/class-weight/oversample=3). At this tiny budget, left-truncation keeps only the last 128 tokens -- almost entirely a tail slice of PAGE content (price/product-name lines), essentially zero transcript signal for most instances. Best dev epoch4 (macro_f1=0.616, none=0.541). Test macro_f1=0.577/none_f1=0.519 -- both the BEST test scores seen anywhere in this classifier's history, surprisingly. CONCLUSION: informative but likely partly noise given small test-holdout none counts (same caveat as everywhere else this session) -- but notable that even a minimal PAGE-tail slice carries strong signal, consistent with the truncation-side finding's premise that PAGE content matters a lot for st1. Not conclusively 'better than 512' given the established noise band, but a useful data point for the context-length-vs-performance curve."
new,lora_train_st1_classifier.py,FacebookAI/roberta-base,multiclass_st1_5way,0.595,0.437,n/a,n/a,0.509,0.222,n/a,n/a,keep,"Same sweep, --max-length 256. Best dev epoch5 (macro_f1=0.595, none=0.437), test macro_f1=0.509/none_f1=0.222 -- worse than both 128 and 512 on test, non-monotonic with respect to length. CONCLUSION: the max-length-vs-performance relationship in the 128-512 range is noisy/non-monotonic on this small test-holdout, not a clean trend -- don't over-read a single sweep point. Filed as a data point for the context-length curve, not as a standalone recommendation."
new,lora_train_st1_classifier.py,nlpaueb/legal-bert-base-uncased,multiclass_st1_5way,0.518,0.279,n/a,n/a,0.466,0.214,n/a,n/a,keep,"Re-test of legal-bert-base-uncased with TWO fixes applied vs the original untuned attempt: --truncation-side left (this session's major finding) and a higher LR (5e-4 vs the original 2e-4, borrowed straight from roberta's tuned recipe -- per the original attempt's conclusion that legal-bert 'would need its own LR sweep before writing off the architecture'). Best dev checkpoint epoch2 (macro_f1=0.518, none=0.279) -- NOTE dev peaked early and degraded afterward (epoch3=0.494, epoch4=0.480 with none_f1 COLLAPSING to 0.000, epoch5=0.497 with none still 0.000) -- unlike roberta's smooth monotonic-ish climb, legal-bert at this LR overshoots and the none class destabilizes past epoch 2, suggesting 5e-4 may still be too aggressive or needs a shorter epoch cap / early stopping for this architecture. Test macro_f1=0.466 (digital=0.796, none=0.214, other=0.000, physical_goods=0.835, physical_services=0.486), test none_f1=0.214. CONCLUSION: BOTH fixes together produce a large, real improvement over the original legal-bert attempt (dev 0.394->0.518, +0.124; test 0.339->0.466, +0.127; test none_f1 0.000->0.214, no longer a total collapse) -- confirms the original conclusion that legal-bert was unfairly handicapped by untuned hyperparameters AND the truncation bug. However, legal-bert STILL clearly trails roberta-base's truncation-side=left standing default (dev 0.622-0.645, test 0.538-0.546) by a wide margin even after both fixes -- roberta-base remains the clear standing encoder choice for this track. legal-bert's early-epoch peak + late-epoch none-collapse suggests there may be more headroom with a lower LR or fewer epochs, but not pursuing further given roberta's clear lead."
new,lora_train_st1_classifier.py,FacebookAI/roberta-base,multiclass_st1_5way,0.598,0.353,n/a,n/a,0.507,0.111,n/a,n/a,discard,"lora-dropout sweep on top of the new --truncation-side left standing default (never tried this axis before): --lora-dropout 0.0 (vs standing 0.1), everything else unchanged. Best dev checkpoint epoch5 (macro_f1=0.598, none=0.353) -- below the truncation-left baseline's dev range (0.622-0.645). Test macro_f1=0.507/none_f1=0.111 -- also below baseline (0.538-0.546/0.222-0.316), and none_f1=0.111 is one of the worst test-none scores seen this session. CONCLUSION: removing LoRA dropout regularization hurts -- the standing default of 0.1 is doing real work. Testing 0.2 next to see if more regularization helps further."
new,lora_train_st1_classifier.py,FacebookAI/roberta-base,multiclass_st1_5way,0.599,0.312,n/a,n/a,0.563,0.385,n/a,n/a,keep,"lora-dropout sweep, --lora-dropout 0.2 (vs standing 0.1 and the just-tested 0.0). Best dev checkpoint epoch5 (macro_f1=0.599, none=0.312) -- below the truncation-left/dropout=0.1 baseline's dev range (0.622-0.645), similar to dropout=0's dev (0.598). But test macro_f1=0.563/none_f1=0.385 -- the 2nd-best test macro_f1 seen anywhere in this classifier's history (only beaten by the --max-length=128 run's 0.577) and a strong none_f1, clearly above dropout=0.1's test range (0.538-0.546/0.222-0.316). Dev still >= test (gap 0.036), a trustworthy agreeing pattern per feedback_rotating_test_holdout, unlike dropout=0's collapse. CONCLUSION: non-monotonic across the dropout sweep (0 worst on both dev/test, 0.1 best on dev, 0.2 best on test among the 512-length configs) -- genuinely ambiguous ranking, not a clean win or loss for 0.2 vs the 0.1 standing default. Worth a fresh-split replicate before promoting over 0.1, but a legitimate candidate given the tight, trustworthy dev/test gap -- not dismissing outright like dropout=0."
new,lora_train_st1_classifier.py,FacebookAI/roberta-base,multiclass_st1_5way,0.569,0.439,n/a,n/a,0.531,0.270,n/a,n/a,discard,"REPLICATE (fresh split) of --lora-dropout 0.2. Best dev checkpoint epoch4 (macro_f1=0.569, none=0.439). Test macro_f1=0.531/none_f1=0.270 -- pulls back sharply from run 1's 0.563/0.385 toward the middle of the pack, same rotating-test-holdout noise pattern seen repeatedly this session. Averaged across both dropout=0.2 replicates: dev~0.584, test~0.547 -- essentially TIED with dropout=0.1's averaged test (~0.542) but CLEARLY BELOW dropout=0.1's averaged dev (~0.634, a 0.05 gap). CONCLUSION: dropout=0.2's apparent test-side edge from run 1 did not hold up -- dropout=0.1 remains the better choice on the cleaner/more trustworthy dev signal, and is now essentially a wash or slight win on test too once averaged. Dropout sweep is now a fully closed question: 0.1 (standing) > 0.2 > 0.0, confirmed via replicate."
new,lora_train_st1_classifier.py,allenai/longformer-base-4096,multiclass_st1_5way,0.615,0.593,n/a,n/a,0.618,0.471,n/a,n/a,keep,"FIRST genuinely-long-context encoder test for this classifier, following the truncation-side discovery: allenai/longformer-base-4096 (native 4096 position embeddings, provided locally by the user at ./models/allenai/longformer-base-4096), --max-length 4096 (covers 99.51%% of instances fully vs roberta-base's 512-token ceiling's 2.5%%), standing recipe otherwise (r8/a16 LoRA on query,value only -- NOT query_global/value_global, a candidate follow-up -- class-weight, oversample-rare-st1=3, truncation-side left still set for the rare >4096-token tail). batch-size=2 (batch=4 OOM'd on this 23GB A10G; Longformer's HF eager sliding-window attention via a hand-rolled einsum-based chunked implementation is much more memory-hungry than its 'linear attention' reputation suggests -- no flash-attention kernel available for it). Wall-clock: 1h33m58s total (started 01:24:15, finished 02:58:13), steady-state ~15-20 min/epoch after a slower first epoch (~26 min, likely CUDA/dataloader warmup). RESULT: best dev checkpoint epoch2 (macro_f1=0.615, per-label: digital=0.895, none=0.593, other=0.000, physical_goods=0.909, physical_services=0.681) -- dev none_f1=0.593 is the best none score seen ANYWHERE in this classifier's history (previous best 0.562). Test macro_f1=0.618 (digital=0.903, none=0.471, other=0.000, physical_goods=0.933, physical_services=0.783) -- the BEST test macro_f1 seen anywhere in this classifier's entire history (previous best 0.577, from a roberta max-length=128 run), with dev/test essentially tied (gap 0.003, about as clean an agreement as this noisy small-test-holdout task produces). CONCLUSION: giving the classifier genuine access to the context Track 1 already confirmed matters (vs roberta's severely truncated 2.5%% coverage) produces a real, substantial win -- confirms the hypothesis behind sourcing a longer-context model. NOT yet replicated (standing practice: always replicate before fully trusting) -- a replicate command is included in slurm_dispatch_st_classifiers.txt (dispatched to an H100 cluster by the user). Global-attention LoRA adaptation (query_global/value_global, currently frozen) is a promising untried follow-up given how much this architecture already helps."
